{
  "project": "PANEL-REVIZE",
  "version": "1.0.0",
  "lastUpdated": "2026-08-03T00:00:00Z",
  "status": "in-progress",
  "currentTaskId": "0.1",
  "completedTasks": [],
  "pendingTasks": [
    "0.1",
    "0.2",
    "0.3",
    "0.4",
    "0.5",
    "1.1",
    "1.2",
    "1.3",
    "1.4",
    "2.1",
    "2.2",
    "2.3",
    "2.4",
    "2.5",
    "3.1",
    "3.2",
    "3.3",
    "3.4",
    "3.5",
    "3.6",
    "4.1",
    "4.2",
    "4.3",
    "4.4",
    "4.5",
    "4.6",
    "4.7",
    "4.8",
    "5.1",
    "5.2",
    "5.3",
    "5.4",
    "5.5",
    "5.6",
    "5.7",
    "6.1",
    "6.2",
    "6.3",
    "6.4",
    "6.5",
    "7.1",
    "7.2",
    "7.3",
    "7.4",
    "8.1",
    "8.2",
    "8.3",
    "9.1",
    "9.2",
    "9.3",
    "9.4",
    "9.5"
  ],
  "blockers": [],
  "evidence": [
    {
      "recordedAt": "2026-08-03T00:00:00Z",
      "taskId": "0.1",
      "kind": "note",
      "summary": "PANEL-REVIZE-PLANI klasörü ve plan dosyaları oluşturuldu. Uygulama henüz başlamadı.",
      "files": [
        "PANEL-REVIZE-PLANI/00-PANEL-ANA-PROMPT.md",
        "PANEL-REVIZE-PLANI/00-UYGULAMA-YAPISI-ANALIZI.md",
        "PANEL-REVIZE-PLANI/01-MEVCUT-SORUNLAR-ANALIZI.md",
        "PANEL-REVIZE-PLANI/02-TASARIM-ILKELERI-VE-VIZYON.md",
        "PANEL-REVIZE-PLANI/03-BILGI-MIMARISI-VE-SEVKIYAT.md",
        "PANEL-REVIZE-PLANI/04-KOMPONENT-KUTUPHANESI.md",
        "PANEL-REVIZE-PLANI/05-ESTETIK-DESIGN-SISTEMI.md",
        "PANEL-REVIZE-PLANI/06-VERI-GUVENLIGI-VE-HATA-DURUMLARI.md",
        "PANEL-REVIZE-PLANI/07-UYGULAMA-FAZLARI-VE-KABUL-KAPISI.md",
        "PANEL-REVIZE-PLANI/panel-revize-manifest.json",
        "PANEL-REVIZE-PLANI/panel-revize-tasks.json",
        "PANEL-REVIZE-PLANI/panel-revize-state-schema.json",
        "PANEL-REVIZE-PLANI/panel-revize-state-example.json",
        "PANEL-REVIZE-PLANI/panel-revize-acceptance-schema.json"
      ]
    }
  ],
  "nextTaskId": "0.1",
  "notes": "Planlama tamamlandı. İlk uygulama görevi: panel-v2.html shell oluştur."
}
